{
  "schema": "kiln.capability-compatibility/v1",
  "harness": "opencode-v2",
  "sdk": {
    "package": "@opencode-ai/sdk",
    "version": "1.18.18",
    "npmIntegrity": "sha512-zJlwXskIR47V1dkPJqeKBgq7nejG1uU8lJaGIGqbX3MWRCT8vKn0fEotbxuPCKnTdmWsDyNGNg9q1qIliDSMDA=="
  },
  "runtime": {
    "name": "opencode",
    "observedVersion": "1.18.16",
    "observedAt": "2026-08-14",
    "relationshipToSdk": "The local executable observation predates SDK admission to 1.18.18 and is retained separately; runtime parity is not claimed."
  },
  "source": {
    "repository": "https://github.com/anomalyco/opencode",
    "tag": "v1.18.18",
    "commit": "31406ccc51b4bd2a4e1e086b2bcaa5f7f804f26d"
  },
  "sourceArtifacts": [
    { "id": "v2-types", "origin": "official-repository", "path": "packages/sdk/js/src/v2/gen/types.gen.ts", "sha256": "c9d18948502ba2428a4a544dc40e619588a256fe205b3c2d2f07ccf1bf860c04", "supports": "V2 correlated tool part states, event payloads, permissions, and experimental discovery route declarations." },
    { "id": "v2-client", "origin": "official-repository", "path": "packages/sdk/js/src/v2/gen/sdk.gen.ts", "sha256": "a9e01ec182be0a9c2bd8eb220c65eaef5f3f308bd3298406666624f5abe41cb5", "supports": "Generated V2 client methods and exact experimental endpoint paths." },
    { "id": "plugin-contract", "origin": "official-repository", "path": "packages/plugin/src/index.ts", "sha256": "7ce98ddab759903e6618b40a1c8beb1b621f0691f8f508ad2c07dba2041744e1", "supports": "Released legacy/root plugin hooks and exported V2 plugin domains." }
  ],
  "capabilities": [
    { "id": "opencode.correlated-tool-events", "classification": "portable-function/mcp", "stability": "stable", "eligible": true, "representation": "lossless", "semanticLoss": [], "sourceArtifacts": ["v2-types"] },
    { "id": "opencode.stable-schema-discovery", "classification": "lossy/unrepresentable", "stability": "stable", "eligible": false, "representation": "unrepresentable", "semanticLoss": ["The released V2 SDK provides no stable tool-schema discovery endpoint."], "sourceArtifacts": ["v2-client", "v2-types"] },
    { "id": "opencode.experimental-tool-discovery", "classification": "lossy/unrepresentable", "stability": "experimental", "eligible": false, "representation": "unrepresentable", "semanticLoss": ["Experimental routes are not an admitted discovery contract."], "sourceArtifacts": ["v2-client", "v2-types"], "endpoints": ["/experimental/tool", "/experimental/tool/ids"] },
    { "id": "opencode.plugin-hooks", "classification": "harness-private", "stability": "stable", "eligible": false, "representation": "lossy", "semanticLoss": ["Released plugin hooks are harness extension contracts, not a consumed portable schema-discovery surface."], "sourceArtifacts": ["plugin-contract"] }
  ],
  "fixture": { "path": "fixtures/opencode-v2-events.json", "sha256": "12e6043826434b71f0ebb88a7399024304b87175ed576574ef019c4d2973b288", "kind": "synthetic" },
  "liveEvidence": [
    { "scope": "executable-version", "command": "opencode --version", "bound": "one local read-only invocation before SDK upgrade", "status": "observed", "result": "1.18.16" },
    { "scope": "provider-cancellation-lifecycle", "command": "bun run test:managed-agents:live", "bound": "one governed synthetic cancellation fixture run in the serial managed-agent live suite", "status": "observed", "result": "OpenCode executable 1.18.16 with opencode/minimax-m2.5-free passed the canonical cancellation lifecycle proof." },
    { "scope": "provider-tool-event-contract-at-sdk-1.18.18", "command": "bun run test:managed-agents:live", "bound": "serial managed-agent live suite using the locally available executable", "status": "not-run", "result": "Executable parity with SDK 1.18.18 and stable live tool-schema discovery were not proven." }
  ]
}
