{
  "schema": "kiln.capability-compatibility/v1",
  "harness": "codex",
  "sdk": {
    "package": "@openai/codex-sdk",
    "version": "0.147.0",
    "npmIntegrity": "sha512-nJL0maDBZy31uEArs+u46tW22veNdHjfs96AGaFTnI3jF+g8U+a422uaPiDZwEKmyxcNwStTRz6sIh6C7XxGFQ=="
  },
  "runtime": {
    "name": "codex",
    "observedVersion": "0.147.0",
    "observedAt": "2026-08-14",
    "relationshipToSdk": "The locally observed executable and SDK package versions match; runtime behavior remains separate live evidence."
  },
  "source": {
    "repository": "https://github.com/openai/codex",
    "tag": "rust-v0.147.0",
    "commit": "be6e8eac029b183056b7e4402879f15d2c85f61b"
  },
  "sourceArtifacts": [
    { "id": "sdk-items", "origin": "official-repository", "path": "sdk/typescript/src/items.ts", "sha256": "baee8195a8b1820301973ead2bc33678ac50886823b5ab65360f7e5d6d35ffea", "supports": "Item payloads for command execution, MCP calls, hosted web search, todo lists, and file changes." },
    { "id": "sdk-events", "origin": "official-repository", "path": "sdk/typescript/src/events.ts", "sha256": "dca9d5a0c216eff99f242067814be1985c027e64bf38ab4a6b6fe5c2571a4403", "supports": "Stable item lifecycle event envelope used by the SDK." }
  ],
  "capabilities": [
    { "id": "codex.mcp-tool-call", "classification": "portable-function/mcp", "stability": "stable", "eligible": true, "representation": "lossless", "semanticLoss": [], "sourceArtifacts": ["sdk-items", "sdk-events"] },
    { "id": "codex.command-execution", "classification": "harness-private", "stability": "stable", "eligible": true, "representation": "lossless", "semanticLoss": [], "sourceArtifacts": ["sdk-items", "sdk-events"] },
    { "id": "codex.web-search", "classification": "hosted-provider", "stability": "stable", "eligible": true, "representation": "lossy", "semanticLoss": ["SDK item exposes the query but not a structured search-result set."], "sourceArtifacts": ["sdk-items", "sdk-events"] },
    { "id": "codex.todo-list", "classification": "lossy/unrepresentable", "stability": "stable", "eligible": false, "representation": "lossy", "semanticLoss": ["SDK item is harness progress state, not a portable capability result contract."], "sourceArtifacts": ["sdk-items", "sdk-events"] },
    { "id": "codex.file-change", "classification": "harness-private", "stability": "stable", "eligible": true, "representation": "lossy", "semanticLoss": ["Change summaries do not carry the full applied patch or filesystem authority evidence."], "sourceArtifacts": ["sdk-items", "sdk-events"] }
  ],
  "fixture": { "path": "fixtures/codex-events.json", "sha256": "bbc8ad72e95453cc44925a7f887261835956c030c64c7daca23fad05312f6b79", "kind": "synthetic" },
  "liveEvidence": [
    { "scope": "executable-version", "command": "codex --version", "bound": "one local read-only invocation", "status": "observed", "result": "codex-cli 0.147.0" },
    { "scope": "provider-read-only-capability", "command": "bunx vitest run --config vitest.live.config.ts tests/managed-agent/codex-live-proof.live.test.ts --maxWorkers=1", "bound": "one governed synthetic read-only fixture through the exact SDK 0.147.0 bundled CLI", "status": "observed", "result": "Codex SDK 0.147.0 with gpt-5.6-sol completed the read-only denial proof without changing the fixture or emitting approved-write evidence." },
    { "scope": "provider-approved-write-capability", "command": "bunx vitest run --config vitest.live.config.ts tests/managed-agent/codex-live-proof.live.test.ts --maxWorkers=1 -t \"records a real Codex approved fixture write as canonical write evidence\"", "bound": "one governed synthetic approved-write fixture through the exact SDK 0.147.0 bundled CLI", "status": "observed", "result": "Codex SDK 0.147.0 with gpt-5.6-sol applied the bounded write, emitted canonical write evidence, and retained no absolute workspace path in durable evidence." }
  ]
}
